{
  "schemaVersion": 1,
  "auditor": "K-R04-key-leak-audit",
  "generatedAt": "2026-10-03T09:15:47.267Z",
  "gitHead": "54e5181e9bfeb08fa1188334ff038d710ecdd7e0",
  "root": ".",
  "scope": {
    "includeRoots": [
      {
        "id": "kernel",
        "prefix": "src",
        "migrationSurface": "target",
        "note": "手机内核迁移目标面",
        "present": true
      },
      {
        "id": "demo-server",
        "prefix": "apps/demo/server",
        "migrationSurface": "reference",
        "note": "电脑侧宿主（不进手机）",
        "present": true
      },
      {
        "id": "mobile-kernel",
        "prefix": "apps/mobile-kernel",
        "migrationSurface": "target",
        "note": "K 线手机内核",
        "present": true
      },
      {
        "id": "mobile-ui",
        "prefix": "apps/mobile-ui",
        "migrationSurface": "target",
        "note": "前端线手机 UI",
        "present": true
      },
      {
        "id": "mobile-plugins",
        "prefix": "src/mobile-plugins",
        "migrationSurface": "target",
        "note": "手机插件",
        "present": true
      },
      {
        "id": "android-app",
        "prefix": "apps/android",
        "migrationSurface": "target",
        "note": "安卓 App 壳（真机侧，备份/剪贴板/崩溃面都在这里）",
        "present": true
      }
    ],
    "excludeDirs": [
      ".claude",
      ".dev-evidence",
      ".git",
      ".gradle",
      ".pnpm-store",
      ".runtime",
      ".task-manifest",
      "__pycache__",
      "build",
      "coverage",
      "dist",
      "docs",
      "node_modules",
      "tests"
    ],
    "excludeFilePatterns": [
      "*.test.ts",
      "*.spec.ts",
      "非代码扩展名",
      "二进制（正文含 NUL）"
    ],
    "filesScanned": 912,
    "filesBySurface": {
      "android-app": 25,
      "demo-server": 44,
      "mobile-kernel": 74,
      "mobile-ui": 83,
      "kernel": 547,
      "mobile-plugins": 139
    },
    "filesByMigrationSurface": {
      "target": 868,
      "reference": 44
    },
    "testFilesExcluded": 418,
    "skippedBinary": [
      {
        "rel": "apps/mobile-ui/src/groups/commands.ts",
        "reason": "binary (NUL byte in first 8 KiB)"
      },
      {
        "rel": "src/adapters/research/__fixtures__/real-flate-3p.pdf",
        "reason": "binary extension .pdf（未扫正文）"
      },
      {
        "rel": "src/adapters/research/__fixtures__/real-word16.docx",
        "reason": "binary extension .docx（未扫正文）"
      }
    ]
  },
  "surfaces": [
    {
      "id": "kernel",
      "prefix": "src",
      "present": true
    },
    {
      "id": "demo-server",
      "prefix": "apps/demo/server",
      "present": true
    },
    {
      "id": "mobile-kernel",
      "prefix": "apps/mobile-kernel",
      "present": true
    },
    {
      "id": "mobile-ui",
      "prefix": "apps/mobile-ui",
      "present": true
    },
    {
      "id": "mobile-plugins",
      "prefix": "src/mobile-plugins",
      "present": true
    },
    {
      "id": "android-app",
      "prefix": "apps/android",
      "present": true
    }
  ],
  "rules": [
    {
      "id": "BK1",
      "sink": "backup",
      "title": "allowBackup 未关闭（密钥随系统备份/迁移外流）",
      "why": "安卓默认 allowBackup=true；应用私有目录（含加密后的 API key）会被纳入云备份与设备迁移。keystore 的加密密钥在 TEE/StrongBox 里不可备份，备份出的密文到新机**解不开**，更要紧的是密文与元数据离开了应用私有边界。",
      "source": "总方案 §3「keystore 加密、备份排除」；K-R04",
      "baseSeverity": "high",
      "count": 0,
      "bySeverity": {}
    },
    {
      "id": "BK2",
      "sink": "backup",
      "title": "allowBackup=false 但缺 dataExtractionRules（API 31+ 设备迁移面未声明）",
      "why": "targetSdk>=31 时，`android:dataExtractionRules` 才是备份/设备迁移的权威声明；只写 allowBackup=false 时，「设备到设备」迁移路径是否仍带走私有目录需以真机验证为准，静态上应显式声明 dataExtractionRules 才能把口径钉死。",
      "source": "总方案 §3；Android dataExtractionRules；K-R04",
      "baseSeverity": "medium",
      "count": 1,
      "bySeverity": {
        "medium": 1
      }
    },
    {
      "id": "BK3",
      "sink": "backup",
      "title": "备份规则 include 了密钥类路径且无 exclude",
      "why": "`<full-backup-content>`/`<data-extraction-rules>` 若通过 include 把 keys/secrets/keystore/.private 等目录纳入备份，就等于把凭据写出私有边界。",
      "source": "总方案 §3；K-R04",
      "baseSeverity": "high",
      "count": 0,
      "bySeverity": {}
    },
    {
      "id": "BK4",
      "sink": "backup",
      "title": "备份规则宽口径 include（domain 覆盖私有目录根）",
      "why": "`<include domain=\"file\" path=\".\"/>`（或 database/sharedpref 根）会把整个私有目录纳入备份，其中必然含密钥库与产物；应是「默认排除 + 精确 include」而非「默认全收」。",
      "source": "总方案 §3；K-R04",
      "baseSeverity": "high",
      "count": 0,
      "bySeverity": {}
    },
    {
      "id": "CB1",
      "sink": "clipboard",
      "title": "剪贴板写入",
      "why": "写入系统剪贴板的文本可被其他应用读取，且部分输入法/历史面板会持久化。产品路径不应把用户可读内容以外的值放上剪贴板。",
      "source": "K-R04「剪贴板审计」",
      "baseSeverity": "medium",
      "count": 0,
      "bySeverity": {}
    },
    {
      "id": "CB2",
      "sink": "clipboard",
      "title": "剪贴板写入/读取涉及密钥类值（高危泄漏）",
      "why": "把密钥、令牌、授权头写进剪贴板，或从剪贴板读取并当作凭据使用，是最直接的 key 外流路径。密钥只应以 keyRef 形式存在，绝不经剪贴板。",
      "source": "总方案 §3；K-R04",
      "baseSeverity": "critical",
      "count": 0,
      "bySeverity": {}
    },
    {
      "id": "CB3",
      "sink": "clipboard",
      "title": "剪贴板写入未标记敏感（EXTRA_IS_SENSITIVE）",
      "why": "Android 13+ 提供 `ClipDescription.EXTRA_IS_SENSITIVE` 让系统在预览/历史里遮蔽内容。写入含敏感内容却不打标，等于放弃系统最后一层保护。",
      "source": "K-R04",
      "baseSeverity": "low",
      "count": 0,
      "bySeverity": {}
    },
    {
      "id": "CB4",
      "sink": "clipboard",
      "title": "剪贴板读取",
      "why": "读取系统剪贴板可能把用户误复制的密钥/凭据带入模型上下文或日志。若读取值随后进入请求或日志，风险叠加。",
      "source": "K-R04",
      "baseSeverity": "medium",
      "count": 0,
      "bySeverity": {}
    },
    {
      "id": "LG1",
      "sink": "logs",
      "title": "日志调用同行带密钥类标识符（高危泄漏）",
      "why": "把 apiKey/secret/token/authorization/keyRef 一类变量直接塞进 `Log.*` / `console.*`，密钥就会进入 logcat、崩溃报告或前端控制台，且常被长期留存与上传。",
      "source": "总方案 §3「…或日志」；K-R04",
      "baseSeverity": "critical",
      "count": 0,
      "bySeverity": {}
    },
    {
      "id": "LG2",
      "sink": "logs",
      "title": "裸流/栈打印（printStackTrace / System.out / dumpStack）",
      "why": "`printStackTrace()`、`System.out/err.print*`、`dumpStack()` 会把异常链或对象打到标准错误/logcat；若信息里含 URL 查询串、请求头或响应体，凭据可能随之外泄。产品路径应走结构化、脱敏的错误上报。",
      "source": "总方案 §3；K-R04",
      "baseSeverity": "medium",
      "count": 0,
      "bySeverity": {}
    },
    {
      "id": "LG3",
      "sink": "logs",
      "title": "结构化日志调用（出口面清点）",
      "why": "统计性质：记录存在哪些结构化日志出口（Log.*/console.*/NSLog），便于后续判断「哪些日志会随崩溃报告上传」。本身不是缺陷，severity=info；若同行出现密钥类标识符则由 LG1 升级。",
      "source": "K-R04",
      "baseSeverity": "info",
      "count": 25,
      "bySeverity": {
        "info": 25
      }
    },
    {
      "id": "CR1",
      "sink": "crash",
      "title": "未捕获异常处理器（崩溃诊断出口清点）",
      "why": "自定义 `UncaughtExceptionHandler` 会接管崩溃路径；它是「崩溃时可能把内存里的请求/凭据写盘或上传」的出口。存在本身不是缺陷（severity=info），但需确认其落盘内容已脱敏。",
      "source": "总方案 §3「崩溃诊断脱敏」；K-R04",
      "baseSeverity": "info",
      "count": 0,
      "bySeverity": {}
    },
    {
      "id": "CR2",
      "sink": "crash",
      "title": "崩溃/异常路径同行带密钥类标识符（高危泄漏）",
      "why": "在异常构造或崩溃处理器里拼接 apiKey/token/headers 等，会把凭据写进崩溃日志与第三方报告。",
      "source": "总方案 §3；K-R04",
      "baseSeverity": "high",
      "count": 0,
      "bySeverity": {}
    },
    {
      "id": "CR3",
      "sink": "crash",
      "title": "第三方崩溃上报 SDK（外部外泄面）",
      "why": "Crashlytics/ACRA/Sentry/Bugly 等会把崩溃栈与自定义键上传到第三方。引入即需确认上报内容已脱敏、且密钥不进入上报字段。",
      "source": "总方案 §3；K-R04",
      "baseSeverity": "medium",
      "count": 0,
      "bySeverity": {}
    },
    {
      "id": "SM1",
      "sink": "secret-material",
      "title": "明文密钥字面量（形状启发式）",
      "why": "密钥以字面量进手机包 = 随 APK 分发，且一旦入库无法回收。密钥应走手机侧密钥存储，源码里只允许 keyRef。",
      "source": "总方案 §3；CLAUDE.md 规则 0；K-R04",
      "baseSeverity": "critical",
      "count": 3,
      "bySeverity": {
        "info": 3
      }
    }
  ],
  "summary": {
    "totalFindings": 29,
    "byRule": {
      "BK1": 0,
      "BK2": 1,
      "BK3": 0,
      "BK4": 0,
      "CB1": 0,
      "CB2": 0,
      "CB3": 0,
      "CB4": 0,
      "LG1": 0,
      "LG2": 0,
      "LG3": 25,
      "CR1": 0,
      "CR2": 0,
      "CR3": 0,
      "SM1": 3
    },
    "bySeverity": {
      "medium": 1,
      "info": 28
    },
    "bySurface": {
      "android-app": 26,
      "mobile-kernel": 3
    },
    "bySink": {
      "backup": 1,
      "clipboard": 0,
      "logs": 25,
      "crash": 0,
      "secret-material": 3
    },
    "maxHitsPerRulePerFile": 200
  },
  "byFile": [
    {
      "path": "apps/android/app/src/main/AndroidManifest.xml",
      "surface": "android-app",
      "findings": 1
    },
    {
      "path": "apps/android/app/src/main/java/com/potbot/demo/MainActivity.java",
      "surface": "android-app",
      "findings": 13
    },
    {
      "path": "apps/android/app/src/main/java/com/potbot/demo/PotbotNotificationPermission.java",
      "surface": "android-app",
      "findings": 1
    },
    {
      "path": "apps/android/app/src/main/java/com/potbot/demo/PotbotProgressJobService.java",
      "surface": "android-app",
      "findings": 3
    },
    {
      "path": "apps/android/app/src/main/java/com/potbot/demo/PotbotTaskActions.java",
      "surface": "android-app",
      "findings": 2
    },
    {
      "path": "apps/android/app/src/main/java/com/potbot/demo/PotbotUpgrade.java",
      "surface": "android-app",
      "findings": 2
    },
    {
      "path": "apps/android/app/src/main/java/com/potbot/kernel/runtime/KernelLocalUiBridge.java",
      "surface": "android-app",
      "findings": 3
    },
    {
      "path": "apps/android/app/src/main/java/com/potbot/kernel/runtime/KernelRuntimeService.java",
      "surface": "android-app",
      "findings": 1
    },
    {
      "path": "apps/mobile-kernel/model/port.ts",
      "surface": "mobile-kernel",
      "findings": 1
    },
    {
      "path": "apps/mobile-kernel/observability/redact.ts",
      "surface": "mobile-kernel",
      "findings": 1
    },
    {